{
  "generated_at": "2026-09-07T11:28:51Z",
  "providers": {
    "agy": {
      "aliases": {},
      "binary": "agy",
      "cli": "agy",
      "default_model": "gemini-3.8-flash",
      "default_tier": "medium",
      "model_string_format": "{model}-{tier}",
      "models": [
        {
          "aliases": [],
          "context_window": 1048576,
          "default_tier": "medium",
          "deprecated": false,
          "display_name": "Gemini 3.8 Flash",
          "fetched_at": "2026-09-07T11:28:51Z",
          "id": "gemini-3.8-flash",
          "knowledge": null,
          "last_updated": "2026-09-02",
          "migration": null,
          "modalities": {
            "input": [
              "text",
              "image",
              "video",
              "audio",
              "pdf"
            ],
            "output": [
              "text"
            ]
          },
          "output_tokens": 65536,
          "pricing": {
            "cache_read": 0.075,
            "input": 0.75,
            "input_audio": 0.75,
            "output": 3.75
          },
          "release_date": "2026-09-02",
          "source": "agy-ok+models.dev",
          "tiers": [
            "low",
            "medium",
            "high"
          ],
          "visible": true
        },
        {
          "aliases": [],
          "context_window": 1048576,
          "default_tier": "medium",
          "deprecated": false,
          "display_name": "Gemini 3.7 Flash",
          "fetched_at": "2026-09-07T11:28:51Z",
          "id": "gemini-3.7-flash",
          "knowledge": "2026-03",
          "last_updated": "2026-08-13",
          "migration": null,
          "modalities": {
            "input": [
              "text",
              "image",
              "video",
              "audio",
              "pdf"
            ],
            "output": [
              "text"
            ]
          },
          "output_tokens": 65536,
          "pricing": {
            "cache_read": 0.075,
            "input": 0.75,
            "input_audio": 0.75,
            "output": 3.75
          },
          "release_date": "2026-08-13",
          "source": "agy-ok+models.dev",
          "tiers": [
            "low",
            "medium",
            "high"
          ],
          "visible": true
        },
        {
          "aliases": [],
          "context_window": 1048576,
          "default_tier": "medium",
          "deprecated": false,
          "display_name": "Gemini 3.6 Flash",
          "fetched_at": "2026-09-07T11:28:51Z",
          "id": "gemini-3.6-flash",
          "knowledge": "2026-03",
          "last_updated": "2026-07-21",
          "migration": null,
          "modalities": {
            "input": [
              "text",
              "image",
              "video",
              "audio",
              "pdf"
            ],
            "output": [
              "text"
            ]
          },
          "output_tokens": 65536,
          "pricing": {
            "cache_read": 0.075,
            "input": 0.75,
            "input_audio": 0.75,
            "output": 3.75
          },
          "release_date": "2026-07-21",
          "source": "agy-ok+models.dev",
          "tiers": [
            "low",
            "medium",
            "high"
          ],
          "visible": true
        },
        {
          "aliases": [],
          "context_window": null,
          "default_tier": "high",
          "deprecated": false,
          "display_name": "Gemini 3.1 Pro",
          "fetched_at": "2026-09-07T11:28:51Z",
          "id": "gemini-3.1-pro",
          "knowledge": null,
          "last_updated": null,
          "migration": null,
          "modalities": null,
          "output_tokens": null,
          "pricing": null,
          "release_date": null,
          "source": "agy-ok+models.dev",
          "tiers": [
            "low",
            "high"
          ],
          "visible": true
        },
        {
          "aliases": [],
          "context_window": 1000000,
          "default_tier": "",
          "deprecated": false,
          "display_name": "Claude Sonnet 4.6 (Thinking)",
          "fetched_at": "2026-09-07T11:28:51Z",
          "id": "claude-sonnet-4-6",
          "knowledge": "2025-08-31",
          "last_updated": "2026-03-13",
          "migration": null,
          "modalities": {
            "input": [
              "text",
              "image",
              "pdf"
            ],
            "output": [
              "text"
            ]
          },
          "output_tokens": 128000,
          "pricing": {
            "cache_read": 0.3,
            "cache_write": 3.75,
            "input": 3,
            "output": 15
          },
          "release_date": "2026-02-17",
          "source": "agy-ok+models.dev",
          "tiers": [],
          "visible": true
        },
        {
          "aliases": [],
          "context_window": null,
          "default_tier": "",
          "deprecated": false,
          "display_name": "Claude Opus 4.6 (Thinking)",
          "fetched_at": "2026-09-07T11:28:51Z",
          "id": "claude-opus-4-6-thinking",
          "knowledge": null,
          "last_updated": null,
          "migration": null,
          "modalities": null,
          "output_tokens": null,
          "pricing": null,
          "release_date": null,
          "source": "agy-ok+models.dev",
          "tiers": [],
          "visible": true
        },
        {
          "aliases": [],
          "context_window": null,
          "default_tier": "medium",
          "deprecated": false,
          "display_name": "GPT-OSS 120B",
          "fetched_at": "2026-09-07T11:28:51Z",
          "id": "gpt-oss-120b",
          "knowledge": null,
          "last_updated": null,
          "migration": null,
          "modalities": null,
          "output_tokens": null,
          "pricing": null,
          "release_date": null,
          "source": "agy-ok+models.dev",
          "tiers": [
            "medium"
          ],
          "visible": true
        }
      ],
      "tier_options": [
        "low",
        "medium",
        "high"
      ]
    },
    "claude": {
      "aliases": {
        "best": "fable",
        "default": "claude-opus-5[1m]",
        "fable": "claude-fable-5-1",
        "haiku": "claude-haiku-4-5",
        "opus": "claude-opus-5",
        "opusplan": "opus",
        "sonnet": "claude-sonnet-5"
      },
      "binary": "claude",
      "cli": "claude",
      "default_model": "claude-opus-5[1m]",
      "default_tier": "medium",
      "dispatch": {
        "notes": "Reads paths in the working directory; cannot write files headless.",
        "reads_workspace": true
      },
      "models": [
        {
          "aliases": [
            "opus",
            "opusplan"
          ],
          "context_window": 1000000,
          "default_tier": "medium",
          "deprecated": false,
          "display_name": "Claude Opus 5",
          "fetched_at": "2026-09-07T11:28:48Z",
          "id": "claude-opus-5",
          "knowledge": "2026-05",
          "last_updated": "2026-07-24",
          "migration": null,
          "modalities": {
            "input": [
              "text",
              "image",
              "pdf"
            ],
            "output": [
              "text"
            ]
          },
          "output_tokens": 128000,
          "pricing": {
            "cache_read": 0.5,
            "cache_write": 6.25,
            "input": 5,
            "output": 25
          },
          "release_date": "2026-07-24",
          "source": "claude-binary+overlay+models.dev",
          "tiers": [
            "low",
            "medium",
            "high",
            "xhigh",
            "max"
          ],
          "visible": true
        },
        {
          "aliases": [
            "default",
            "opus",
            "opusplan"
          ],
          "context_window": 1000000,
          "default_tier": "medium",
          "deprecated": false,
          "display_name": "Claude Opus 5 [1M]",
          "fetched_at": "2026-09-07T11:28:48Z",
          "id": "claude-opus-5[1m]",
          "knowledge": "2026-05",
          "last_updated": "2026-07-24",
          "migration": null,
          "modalities": {
            "input": [
              "text",
              "image",
              "pdf"
            ],
            "output": [
              "text"
            ]
          },
          "output_tokens": 128000,
          "pricing": {
            "cache_read": 0.5,
            "cache_write": 6.25,
            "input": 5,
            "output": 25
          },
          "release_date": "2026-07-24",
          "source": "claude-binary+overlay+models.dev",
          "tiers": [
            "low",
            "medium",
            "high",
            "xhigh",
            "max"
          ],
          "visible": true
        },
        {
          "aliases": [
            "sonnet"
          ],
          "context_window": 1000000,
          "default_tier": "medium",
          "deprecated": false,
          "display_name": "Claude Sonnet 5",
          "fetched_at": "2026-09-07T11:28:48Z",
          "id": "claude-sonnet-5",
          "knowledge": "2026-01-31",
          "last_updated": "2026-06-30",
          "migration": null,
          "modalities": {
            "input": [
              "text",
              "image",
              "pdf"
            ],
            "output": [
              "text"
            ]
          },
          "output_tokens": 128000,
          "pricing": {
            "cache_read": 0.2,
            "cache_write": 2.5,
            "input": 2,
            "output": 10
          },
          "release_date": "2026-06-29",
          "source": "claude-binary+overlay+models.dev",
          "tiers": [
            "low",
            "medium",
            "high",
            "xhigh",
            "max"
          ],
          "visible": true
        },
        {
          "aliases": [